title,Authors,1stAuthor,result-from,result-id,result-pub_date,result-title,result-ttl_similarity,result-author,result-link,result-pdf_link
ViT-NeT: Interpretable Vision Transformers with Neural Tree Decoder,Sangwon Kim (Keimyung University) · Jaeyeal Nam (Keimyung University) · Byoung Chul Ko (Keimyung University),Sangwon Kim,Google,,,GitHub - lucidrains/vit-pytorch: Implementation of ,0.22,,https://github.com/lucidrains/vit-pytorch,
Instrumental Variable Regression with Confounder Balancing,"Anpeng Wu (Zhejiang University) · Kun Kuang (Zhejiang University) · Bo Li (Tsinghua University) · Fei Wu (Zhejiang University, China)",Anpeng Wu,Google,,,TREATMENT EFFECT ESTIMATION ,0.326,,https://openreview.net/pdf?id=zxm7rzEPaj,
Optimization-Derived Learning with Essential Convergence Analysis of Training and Hyper-training,Risheng Liu (Dalian University of Technology) · Xuan Liu (Dalian University of Technology) · Shangzhi Zeng (University of Victoria) · Jin Zhang (Southern University of Science and Technology) · Yixuan ZHANG (Southern University of Science and Technology),Risheng Liu,arXiv,http://arxiv.org/abs/2206.07875v1,2022-06-16T01:50:25Z,"Optimization-Derived Learning with Essential Convergence Analysis of
  Training and Hyper-training",0.99,Yixuan Zhang,http://arxiv.org/abs/2206.07875v1,http://arxiv.org/pdf/2206.07875v1
A New Perspective on the Effects of Spectrum in Graph Neural Networks,mingqi yang (Dalian University of Technology) · Yanming Shen (Dalian University of Technology) · Rui Li (Dalian University of Technology) · Heng Qi (Dalian University of Technology) · Qiang Zhang (Dalian University of Technology) · Baocai Yin (Dalian University of Technology),mingqi yang,arXiv,http://arxiv.org/abs/2112.07160v2,2021-12-14T04:50:46Z,A New Perspective on the Effects of Spectrum in Graph Neural Networks,1.0,Baocai Yin,http://arxiv.org/abs/2112.07160v2,http://arxiv.org/pdf/2112.07160v2
A Context-Integrated Transformer-Based Neural Network for Auction Design,Zhijian Duan (Peking University) · Jingwu Tang (Peking University) · Yutong Yin (Peking University) · Zhe Feng (Google Inc.) · Xiang Yan (Shanghai Jiao Tong University) · Manzil Zaheer (Google Research) · Xiaotie Deng (Peking University),Zhijian Duan,arXiv,http://arxiv.org/abs/2201.12489v2,2022-01-29T03:47:00Z,A Context-Integrated Transformer-Based Neural Network for Auction Design,1.0,Xiaotie Deng,http://arxiv.org/abs/2201.12489v2,http://arxiv.org/pdf/2201.12489v2
Multi-Grained Vision Language Pre-Training: Aligning Texts with Visual Concepts,Yan Zeng (ByteDance AI Lab) · Xinsong Zhang (Bytedance AI Lab) · Hang Li (Bytedance Technology),Yan Zeng,Google,,,[2111.08276] ,0.0,,https://arxiv.org/abs/2111.08276,
Learning Domain Adaptive Object Detection with Probabilistic Teacher,Meilin Chen (Zhejiang University) · Weijie Chen (Zhejiang University) · Shicai Yang (Hikvision Research Institute) · Jie Song (Zhejiang University) · Xinchao Wang (National University of Singapore) · Lei Zhang (Chongqing University) · Yunfeng Yan (Zhejiang University) · Donglian Qi (Zhejiang University) · Yueting Zhuang (Zhejiang University) · Di Xie (Hikvision Research Institute) · Shiliang Pu (Hikvision Research Institute),Meilin Chen,arXiv,http://arxiv.org/abs/2206.06293v1,2022-06-13T16:24:22Z,Learning Domain Adaptive Object Detection with Probabilistic Teacher,1.0,Shiliang Pu,http://arxiv.org/abs/2206.06293v1,http://arxiv.org/pdf/2206.06293v1
The Complexity of k-Means Clustering when Little is Known,Robert Ganian (TU Wien) · Thekla Hamm (TU Wien) · Viktoriia Korchemna (TU Wien) · Karolina Okrasa (University of Warsaw) · Kirill Simonov (University of Bergen),Robert Ganian,,,,,0.0,,,
Dataset Condensation with Contrastive Signals,"Saehyung Lee (Seoul National University) · SANGHYUK CHUN (Naver corp.) · Sangwon Jung (Sungkwunkwan university) · Sangdoo Yun ( Clova AI Research, NAVER Corp.) · Sungroh Yoon (Seoul National University)",Saehyung Lee,arXiv,http://arxiv.org/abs/2202.02916v3,2022-02-07T03:05:32Z,Dataset Condensation with Contrastive Signals,1.0,Sungroh Yoon,http://arxiv.org/abs/2202.02916v3,http://arxiv.org/pdf/2202.02916v3
C*-algebra net: a new approach generalizing neural network parameters to C*-algebra,Yuka Hashimoto (NTT) · Zhao Wang (NTT) · Tomoko Matsui (Institute of Statistical Mathematics),Yuka Hashimoto,Google,,,finitely generated ,0.196,,https://mathoverflow.net/questions/406414/finitely-generated-c-algebra-as-cx,
Active Learning on a Budget: Opposite Strategies Suit High and Low Budgets,"Guy Hacohen (Hebrew University of Jerusalem) · Avihu Dekel (Hebrew University) · Daphna Weinshall (Hebrew University of Jerusalem, Israel)",Guy Hacohen,arXiv,http://arxiv.org/abs/2202.02794v4,2022-02-06T15:09:05Z,"Active Learning on a Budget: Opposite Strategies Suit High and Low
  Budgets",0.987,Daphna Weinshall,http://arxiv.org/abs/2202.02794v4,http://arxiv.org/pdf/2202.02794v4
FedNL: Making Newton-Type Methods Applicable to Federated Learning,Mher Safaryan (KAUST) · Rustem Islamov (MIPT) · Xun Qian (KAUST) · Peter Richtarik (KAUST),Mher Safaryan,arXiv,http://arxiv.org/abs/2106.02969v2,2021-06-05T21:30:11Z,FedNL: Making Newton-Type Methods Applicable to Federated Learning,1.0,Peter Richtárik,http://arxiv.org/abs/2106.02969v2,http://arxiv.org/pdf/2106.02969v2
Tell me why! Explanations support learning relational and causal structure,Andrew Lampinen (DeepMind) · Nicholas Roy (DeepMind) · Ishita Dasgupta (DeepMind) · Stephanie Chan (DeepMind) · Allison Tam (DeepMind) · James McClelland (Stanford University and Deepmind) · Chen Yan () · Adam Santoro (DeepMind) · Neil Rabinowitz (DeepMind) · Jane Wang (DeepMind) · Feilx Hill (Deepmind),Andrew Lampinen,arXiv,http://arxiv.org/abs/2112.03753v3,2021-12-07T15:09:06Z,"Tell me why! Explanations support learning relational and causal
  structure",0.987,Felix Hill,http://arxiv.org/abs/2112.03753v3,http://arxiv.org/pdf/2112.03753v3
A Natural Actor-Critic Framework for Zero-Sum Markov Games,Ahmet Alacaoglu (University of Wisconsin-Madison) · Luca Viano (EPFL) · Niao He (ETH Zurich) · Volkan Cevher (EPFL),Ahmet Alacaoglu,,,,,0.0,,,
Injecting Logical Constraints into Neural Networks via Straight-Through Estimators,Zhun Yang (Arizona State University) · Joohyung Lee (Samsung Research / Arizona State university) · Chiyoun Park (Samsung Research),Zhun Yang,,,,,0.0,,,
Bayesian Continuous-Time Tucker Decomposition,Shikai Fang (University of Utah) · Akil Narayan (University of Utah) · Robert Kirby (University of Utah) · Shandian Zhe (University of Utah),Shikai Fang,,,,,0.0,,,
Private Streaming SCO in ℓpℓp\ell_p geometry with Applications in High Dimensional Online Decision Making,Yuxuan Han (HKUST) · Zhicong Liang (Hong Kong University of Science and Technology) · Zhipeng Liang (Hong Kong University of Science and Technology) · Yang Wang (HKUST) · Yuan Yao (HongKong University of Science and Technology and Peking University) · Jiheng Zhang (HKUST),Yuxuan Han,Google,,,Title: On ,0.104,,https://arxiv-export-lb.library.cornell.edu/abs/2206.08111,
XAI for Transformers: Better Explanations through Conservative Propagation,"Ameen Ali (Tel Aviv University, Israel) · Thomas Schnake (TU Berlin) · Oliver Eberle (TU Berlin) · Grégoire Montavon (Technische Universität Berlin) · Klaus-robert Mueller (Technische Universität Berlin) · Lior Wolf (Facebook AI Research and Tel Aviv University)",Ameen Ali,arXiv,http://arxiv.org/abs/2202.07304v1,2022-02-15T10:47:11Z,"XAI for Transformers: Better Explanations through Conservative
  Propagation",0.987,Lior Wolf,http://arxiv.org/abs/2202.07304v1,http://arxiv.org/pdf/2202.07304v1
Secure Distributed Training at Scale,"Eduard Gorbunov (Moscow Institute of Physics and Technology) · Alexander Borzunov (HSE University, Yandex) · Michael Diskin (Yandex) · Max Ryabinin (Yandex/HSE University)",Eduard Gorbunov,arXiv,http://arxiv.org/abs/2106.11257v2,2021-06-21T17:00:42Z,Secure Distributed Training at Scale,1.0,Max Ryabinin,http://arxiv.org/abs/2106.11257v2,http://arxiv.org/pdf/2106.11257v2
Implicit Bias of Linear Equivariant Networks,Hannah Lawrence (MIT) · Bobak T Kiani (MIT) · Kristian Georgiev (MIT) · Andrew Dienes (Massachusetts Institute of Technology),Hannah Lawrence,arXiv,http://arxiv.org/abs/2110.06084v2,2021-10-12T15:34:25Z,Implicit Bias of Linear Equivariant Networks,1.0,Bobak T. Kiani,http://arxiv.org/abs/2110.06084v2,http://arxiv.org/pdf/2110.06084v2
Role-based Multiplex Network Embedding,Hegui Zhang (Southwestern University of Finance and Economics) · Gang Kou (Southwestern University of Finance and Economics),Hegui Zhang,Google,,,MultiVERSE: a ,0.269,,https://www.nature.com/articles/s41598-021-87987-1,
Structure preserving neural networks: A case study in the entropy closure of the Boltzmann equation,Steffen Schotthöfer (Karlsruhe Institute of Technology (KIT)) · Tianbai Xiao (Karlsruhe Institute of Technology (KIT)) · Martin Frank (Karlsruhe Institute of Technology (KIT)) · Cory Hauck (Oak Ridge National Lab),Steffen Schotthöfer,Google,,,(PDF) ,0.057,,https://www.researchgate.net/publication/358118271_Neural_network-based_structure-preserving_entropy_closures_for_the_Boltzmann_moment_system,
Adapting to Mixing Time in Stochastic Optimization with Markovian Data,Ron Dorfman (Technion) · Kfir Levy (Technion),Ron Dorfman,arXiv,http://arxiv.org/abs/2202.04428v1,2022-02-09T12:43:11Z,Adapting to Mixing Time in Stochastic Optimization with Markovian Data,1.0,Kfir Y. Levy,http://arxiv.org/abs/2202.04428v1,http://arxiv.org/pdf/2202.04428v1
Deep and Flexible Graph Neural Architecture Search,Wentao Zhang (Peking University) · Yu Shen (Peking University) · Zheyu Lin (Peking University) · Yang Li (Peking University) · Zhi Yang (Peking University) · Bin Cui (Peking University),Wentao Zhang,arXiv,http://arxiv.org/abs/2206.08582v1,2022-06-17T06:47:21Z,DFG-NAS: Deep and Flexible Graph Neural Architecture Search,0.917,Bin Cui,http://arxiv.org/abs/2206.08582v1,http://arxiv.org/pdf/2206.08582v1
Bregman Proximal Langevin Monte Carlo via Bregman--Moreau Envelopes,Tim Tsz-Kit Lau (Northwestern University) · Han Liu (Northwestern),Tim Tsz-Kit Lau,,,,,0.0,,,
Interactive Inverse Reinforcement Learning for Cooperative Games,Thomas Kleine Büning (University of Oslo) · Anne-Marie George (University of Oslo) · Christos Dimitrakakis (Chalmers / Harvard / Lille / Oslo),Thomas Kleine Büning,Google,,,Towards ,0.139,,"https://jan.leike.name/publications/Towards%20Interactive%20Inverse%20Reinforcement%20Learning%20-%20Armstrong,%20Leike%202016.pdf",
A Tree-based Model Averaging Approach for Personalized Treatment Effect Estimation from Heterogeneous Data Sources,Xiaoqing (Ellen) Tan (University of Pittsburgh) · Chung-Chou H. Chang (University of Pittsburgh) · Ling Zhou (Southwestern University of Finance and Economics) · Lu Tang (University of Pittsburgh),Xiaoqing,arXiv,http://arxiv.org/abs/2103.06261v3,2021-03-10T18:51:30Z,"A Tree-based Model Averaging Approach for Personalized Treatment Effect
  Estimation from Heterogeneous Data Sources",0.991,Lu Tang,http://arxiv.org/abs/2103.06261v3,http://arxiv.org/pdf/2103.06261v3
Algorithms for the Communication of Samples,Lucas Theis (Google) · Noureldin Yosri Yehia Ahmed (Google),Lucas Theis,arXiv,http://arxiv.org/abs/2110.12805v3,2021-10-25T11:04:01Z,Algorithms for the Communication of Samples,1.0,Noureldin Yosri,http://arxiv.org/abs/2110.12805v3,http://arxiv.org/pdf/2110.12805v3
Interactive Correlation Clustering with Existential Cluster Constraints,Rico Angell (University of Massachusetts Amherst) · Nicholas Monath (Google Research) · Nishant Yadav (University of Massachusetts Amherst) · Andrew McCallum (UMass Amherst),Rico Angell,Google,,,Constrained ,0.217,,https://dl.acm.org/doi/10.5555/1404506,
Discrete Tree Flows via Tree-Structured Permutations,Mai Elkady (Purdue University) · Jim Lim (Purdue University) · David Inouye (Purdue University),Mai Elkady,,,,,0.0,,,
Off-Policy Fitted Q-Evaluation with Differentiable Function Approximators: Z-Estimation and Inference Theory,Ruiqi Zhang (Peking University) · Xuezhou Zhang (Princeton) · Chengzhuo Ni (Princeton University) · Mengdi Wang (Princeton University),Ruiqi Zhang,,,,,0.0,,,
Supervised Learning with General Risk Functionals,Liu Leqi (Carnegie Mellon University) · Audrey Huang (University of Illinois Urbana-Champaign) · Zachary Lipton (Carnegie Mellon University) · Kamyar Azizzadenesheli (Purdue University),Liu Leqi,,,,,0.0,,,
Exploiting Redundancy: Separable Group Convolutional Networks on Lie Groups,David Knigge (University of Amsterdam) · David Romero (Vrije Universiteit Amsterdam) · Erik Bekkers (University of Amsterdam),David Knigge,arXiv,http://arxiv.org/abs/2110.13059v2,2021-10-25T15:56:53Z,"Exploiting Redundancy: Separable Group Convolutional Networks on Lie
  Groups",0.987,Erik J. Bekkers,http://arxiv.org/abs/2110.13059v2,http://arxiv.org/pdf/2110.13059v2
More Efficient Sampling for Tensor Decomposition with Worst-Case Guarantees,Osman Asif Malik (Lawrence Berkeley National Laboratory),Osman Asif Malik,arXiv,http://arxiv.org/abs/2110.07631v2,2021-10-14T18:00:31Z,"More Efficient Sampling for Tensor Decomposition With Worst-Case
  Guarantees",0.987,Osman Asif Malik,http://arxiv.org/abs/2110.07631v2,http://arxiv.org/pdf/2110.07631v2
Stochastic Continuous Submodular Maximization: Boosting via Non-oblivious Function,"Qixin Zhang (City University of Hong Kong) · Zengde Deng (Cainiao Network) · Zaiyi Chen (University of Science and Technology of China) · Haoyuan Hu (Artificial Intelligence Department, Zhejiang Cainiao Supply Chain Management Co.) · Yu Yang (City University of Hong Kong)",Qixin Zhang,arXiv,http://arxiv.org/abs/2201.00703v3,2022-01-03T15:10:17Z,"Stochastic Continuous Submodular Maximization: Boosting via
  Non-oblivious Function",0.988,Yu Yang,http://arxiv.org/abs/2201.00703v3,http://arxiv.org/pdf/2201.00703v3
Robustness in Multi-Objective Submodular Optimization: a Quantile Approach,Cedric Malherbe (Huawei Noah's Ark Lab) · Kevin Scaman (INRIA Paris),Cedric Malherbe,,,,,0.0,,,
Translating Robot Skills: Learning Unsupervised Skill Correspondences Across Robots,Tanmay Shankar (Carnegie Mellon University) · Yixin Lin (Meta AI) · Aravind Rajeswaran (FAIR) · Vikash Kumar (Univ. Of Washington) · Stuart Anderson (Facebook AI Research) · Jean Oh (Carnegie Mellon University),Tanmay Shankar,Google,,,Toward next-generation learned ,0.281,,https://www.science.org/doi/10.1126/scirobotics.abd9461,
G22^2CN: Graph Gaussian Convolution Networks with Concentrated Graph Filters,Mingjie Li (Peking University) · Xiaojun Guo (Peking University) · Yifei Wang (Peking University) · Yisen Wang (Peking University) · Zhouchen Lin (Peking University),Mingjie Li,Google,,,Understanding ,0.111,,https://distill.pub/2021/understanding-gnns/,
Doubly Robust Distributionally Robust Off-Policy Evaluation and Learning,Kaiwen Wang (Cornell University and Cornell Tech) · Xiaojie Mao (Tsinghua University) · Zhengyuan Zhou (Arena Technologies & New York University) · Nathan Kallus (Cornell University),Kaiwen Wang,arXiv,http://arxiv.org/abs/2202.09667v1,2022-02-19T20:00:44Z,Doubly Robust Distributionally Robust Off-Policy Evaluation and Learning,1.0,Zhengyuan Zhou,http://arxiv.org/abs/2202.09667v1,http://arxiv.org/pdf/2202.09667v1
Zero-shot AutoML with Pretrained Models,Ekrem Öztürk (University of Freiburg) · Fabio Ferreira (University of Freiburg) · Hadi S Jomaa (Stiftung Universitat Hildesheim) · Lars Schmidt-Thieme (University of Hildesheim) · Josif Grabocka (Albert-Ludwigs-Universität Freiburg) · Frank Hutter (University of Freiburg and Bosch Center for Artificial Intelligence),Ekrem Öztürk,,,,,0.0,,,
Fast Composite Optimization and Statistical Recovery in Federated Learning,Yajie Bao (Shanghai Jiao Tong University) · Michael Crawshaw (George Mason University) · Shan Luo (Shanghai Jiao Tong University) · Mingrui Liu (George Mason University),Yajie Bao,,,,,0.0,,,
Frustratingly Easy Transferability Estimation,Long-Kai Huang (Tencent AI Lab) · Ying WEI (City University of Hong Kong) · Yu Rong (Tencent AI Lab) · Qiang Yang (Hong Kong UST) · Junzhou Huang (University of Texas at Arlington / Tencent AI Lab),Long-Kai Huang,arXiv,http://arxiv.org/abs/2106.09362v2,2021-06-17T10:27:52Z,Frustratingly Easy Transferability Estimation,1.0,Junzhou Huang,http://arxiv.org/abs/2106.09362v2,http://arxiv.org/pdf/2106.09362v2
Quant-BnB: A Scalable Branch-and-Bound Method for Optimal Decision Trees with Continuous Features,Rahul Mazumder (Massachusetts Institute of Technology) · Xiang Meng (Massachusetts Institute of Technology) · Haoyue Wang (Massachusetts Institute of Technology),Rahul Mazumder,Google,,,Adaptive branch and bound algorithm ,0.361,,https://www.sciencedirect.com/science/article/pii/S0167865507000670,
A Functional Information Perspective on Model Interpretation,Itai Gat (Technion) · Nitay Calderon (Technion -- Israel Institute of Technology) · Roi Reichart (Technion) · Tamir Hazan (Technion),Itai Gat,arXiv,http://arxiv.org/abs/2206.05700v2,2022-06-12T09:24:45Z,A Functional Information Perspective on Model Interpretation,1.0,Tamir Hazan,http://arxiv.org/abs/2206.05700v2,http://arxiv.org/pdf/2206.05700v2
Does the Data Induce Capacity Control in Deep Learning?,Rubing Yang (University of Pennsylvania) · Jialin Mao (University of Pennsylvania) · Pratik Chaudhari (University of Pennsylvania/Amazon Web Services),Rubing Yang,arXiv,http://arxiv.org/abs/2110.14163v3,2021-10-27T04:40:27Z,Does the Data Induce Capacity Control in Deep Learning?,1.0,Pratik Chaudhari,http://arxiv.org/abs/2110.14163v3,http://arxiv.org/pdf/2110.14163v3
Neural Network Pruning Denoises the Features and Makes Local Connectivity Emerge in Visual Tasks,"Franco Pellegrini (École normale supérieure, Paris) · Giulio Biroli (ENS)",Franco Pellegrini,Google,,,Back Propagation ,0.177,,https://www.guru99.com/backpropogation-neural-network.html,
Linear Adversarial Concept Erasure,Shaul Ravfogel (Bar Ilan University) · Michael Twiton (Independent) · Yoav Goldberg () · Ryan Cotterell (ETH Zurich),Shaul Ravfogel,arXiv,http://arxiv.org/abs/2201.12091v2,2022-01-28T13:00:17Z,Linear Adversarial Concept Erasure,1.0,Ryan Cotterell,http://arxiv.org/abs/2201.12091v2,http://arxiv.org/pdf/2201.12091v2
Inverse Contextual Bandits: Learning How Behavior Evolves over Time,Alihan Hüyük (University of Cambridge) · Daniel Jarrett (University of Cambridge) · Mihaela van der Schaar (University of Cambridge and UCLA),Alihan Hüyük,,,,,0.0,,,
Why the Rich Get Richer? On the Balancedness of Random Partition Models,Changwoo Lee (Texas A&M University) · Huiyan Sang (Texas A&M University),Changwoo Lee,arXiv,http://arxiv.org/abs/2201.12697v2,2022-01-30T01:19:41Z,Why the Rich Get Richer? On the Balancedness of Random Partition Models,1.0,Huiyan Sang,http://arxiv.org/abs/2201.12697v2,http://arxiv.org/pdf/2201.12697v2
"For Learning in Symmetric Teams, Local Optima are Global Nash Equilibria",Scott Emmons (UC Berkeley) · Caspar Oesterheld (Carnegie Mellon University) · Andrew Critch (UC Berkeley) · Vincent Conitzer (Duke) · Stuart Russell (UC Berkeley),Scott Emmons,Google,,,Strategy ,0.148,,https://www.sciencedirect.com/topics/computer-science/strategy-nash-equilibrium,
Non-Vacuous Generalisation Bounds for Shallow Neural Networks,Feix Biggs (University College London) · Benjamin Guedj (Inria and University College London),Feix Biggs,arXiv,http://arxiv.org/abs/2202.01627v3,2022-02-03T14:59:51Z,Non-Vacuous Generalisation Bounds for Shallow Neural Networks,1.0,Benjamin Guedj,http://arxiv.org/abs/2202.01627v3,http://arxiv.org/pdf/2202.01627v3
Prototype Based Classification from Hierarchy to Fairness,Mycal Tucker (Massachusetts Institute of Technology) · Julie Shah (MIT),Mycal Tucker,arXiv,http://arxiv.org/abs/2205.13997v1,2022-05-27T14:21:41Z,Prototype Based Classification from Hierarchy to Fairness,1.0,Julie Shah,http://arxiv.org/abs/2205.13997v1,http://arxiv.org/pdf/2205.13997v1
Differentially Private Coordinate Descent for Composite Empirical Risk Minimization,Paul Mangold (Inria) · Aurélien Bellet (INRIA) · Joseph Salmon (Université de Montpellier) · Marc Tommasi (),Paul Mangold,arXiv,http://arxiv.org/abs/2110.11688v2,2021-10-22T10:22:48Z,"Differentially Private Coordinate Descent for Composite Empirical Risk
  Minimization",0.988,Marc Tommasi,http://arxiv.org/abs/2110.11688v2,http://arxiv.org/pdf/2110.11688v2
Being Properly Improper,Tyler Sypherd (Arizona State University) · Richard Nock (Google Research) · Lalitha Sankar (Arizona State University),Tyler Sypherd,arXiv,http://arxiv.org/abs/2106.09920v2,2021-06-18T05:00:15Z,Being Properly Improper,1.0,Lalitha Sankar,http://arxiv.org/abs/2106.09920v2,http://arxiv.org/pdf/2106.09920v2
Intriguing Properties of Input-Dependent Randomized Smoothing,"Peter Súkeník (Institute of Science and Technology, Austria (ISTA)) · Aleksei Kuvshinov (Technical University of Munich) · Stephan Günnemann (Technical University of Munich)",Peter Súkeník,Google,,,Riemannian data-dependent ,0.368,,https://www.researchgate.net/publication/361439826_Riemannian_data-dependent_randomized_smoothing_for_neural_networks_certification,
Deep Reference Priors: What is the best way to pretrain a model?,Yansong Gao (University of Pennsylvania) · Rahul Ramesh (University of Pennsylvania) · Pratik Chaudhari (University of Pennsylvania/Amazon Web Services),Yansong Gao,arXiv,http://arxiv.org/abs/2202.00187v2,2022-02-01T02:32:39Z,Deep Reference Priors: What is the best way to pretrain a model?,1.0,Pratik Chaudhari,http://arxiv.org/abs/2202.00187v2,http://arxiv.org/pdf/2202.00187v2
Fair Representation Learning through Implicit Path Alignment,Changjian Shui (Université Laval) · Qi CHEN (Laval University) · Jiaqi Li (University of Western Ontario) · Boyu Wang (University of Western Ontario) · Christian Gagne (Université Laval),Changjian Shui,arXiv,http://arxiv.org/abs/2205.13316v1,2022-05-26T12:46:11Z,Fair Representation Learning through Implicit Path Alignment,1.0,Christian Gagné,http://arxiv.org/abs/2205.13316v1,http://arxiv.org/pdf/2205.13316v1
HyperImpute: Generalized Iterative Imputation with Automatic Model Selection,Bogdan Cebere (University of Cambridge) · Daniel Jarrett (University of Cambridge) · Tennison Liu (University of Cambridge) · Alicia Curth (University of Cambridge) · Mihaela van der Schaar (University of Cambridge and UCLA),Bogdan Cebere,arXiv,http://arxiv.org/abs/2206.07769v1,2022-06-15T19:10:35Z,"HyperImpute: Generalized Iterative Imputation with Automatic Model
  Selection",0.987,Mihaela van der Schaar,http://arxiv.org/abs/2206.07769v1,http://arxiv.org/pdf/2206.07769v1
EDEN: Communication-Efficient and Robust Distributed Mean Estimation for Federated Learning,Shay Vargaftik (VMware) · Ran Ben Basat (UCL) · Amit Portnoy (Ben-Gurion University) · Gal Mendelson (Stanford) · Yaniv Ben Itzhak (VMware) · Michael Mitzenmacher (Harvard),Shay Vargaftik,arXiv,http://arxiv.org/abs/2108.08842v3,2021-08-19T17:59:21Z,"EDEN: Communication-Efficient and Robust Distributed Mean Estimation for
  Federated Learning",0.989,Michael Mitzenmacher,http://arxiv.org/abs/2108.08842v3,http://arxiv.org/pdf/2108.08842v3
Convergence and Recovery Guarantees of the K-Subspaces Method for Subspace Clustering,Peng Wang (University of Michigan) · Huikang Liu (Imperial College London) · Anthony Man-Cho So (The Chinese University of Hong Kong) · Laura Balzano (University of Michigan),Peng Wang,arXiv,http://arxiv.org/abs/2206.05553v2,2022-06-11T15:47:21Z,"Convergence and Recovery Guarantees of the K-Subspaces Method for
  Subspace Clustering",0.988,Laura Balzano,http://arxiv.org/abs/2206.05553v2,http://arxiv.org/pdf/2206.05553v2
The power of first-order smooth optimization for black-box non-smooth problems,Alexander Gasnikov (Moscow Institute of Physics and Technology) · Anton Novitskii (MIPT) · Vasilii Novitskii (MIPT) · Farshed Abdukhakimov (MBZUAI) · Dmitry Kamzolov (Mohamed bin Zayed University of Artificial Intelligence) · Aleksandr Beznosikov (Moscow Institute of Physics and Technology (National Research University)) · Martin Takac (MBZUAI) · Pavel Dvurechenskii (Weierstrass Institute) · Bin Gu (Nanjing University of Information Science & Technology),Alexander Gasnikov,arXiv,http://arxiv.org/abs/2201.12289v2,2022-01-28T17:55:21Z,"The Power of First-Order Smooth Optimization for Black-Box Non-Smooth
  Problems",0.987,Bin Gu,http://arxiv.org/abs/2201.12289v2,http://arxiv.org/pdf/2201.12289v2
Set Norm and Equivariant Skip Connections: Putting the Deep in Deep Sets,Lily Zhang (New York University) · Veronica Tozzo (Massachusets General Hospital  Harvard Medical School) · John Higgins (Massachusets General Hospital - Harvard Medical School) · Rajesh Ranganath (New York University),Lily Zhang,,,,,0.0,,,
Imitation Learning by Estimating Expertise of Demonstrators,"Mark Beliaev (University of California, Santa Barbara) · Andy Shih (Stanford University) · Stefano Ermon (Stanford University) · Dorsa Sadigh (Stanford University) · Ramtin Pedarsani (UC Santa Barbara)",Mark Beliaev,arXiv,http://arxiv.org/abs/2202.01288v2,2022-02-02T21:23:19Z,Imitation Learning by Estimating Expertise of Demonstrators,1.0,Ramtin Pedarsani,http://arxiv.org/abs/2202.01288v2,http://arxiv.org/pdf/2202.01288v2
Combining Diverse Feature Priors,Saachi Jain (Massachusetts Institute of Technology) · Dimitris Tsipras (Stanford University) · Aleksander Madry (MIT),Saachi Jain,arXiv,http://arxiv.org/abs/2110.08220v1,2021-10-15T17:31:10Z,Combining Diverse Feature Priors,1.0,Aleksander Madry,http://arxiv.org/abs/2110.08220v1,http://arxiv.org/pdf/2110.08220v1
