title,Authors,1stAuthor,result-from,result-id,result-pub_date,result-title,result-ttl_similarity,result-author,result-link,result-pdf_link
Self-supervised learning with random-projection quantizer for speech recognition,Chung-Cheng Chiu (Google Brain) · James Qin (Google) · Yu Zhang (Google) · Jiahui Yu (Google) · Yonghui Wu (Google),Chung-Cheng Chiu,arXiv,http://arxiv.org/abs/2202.01855v1,2022-02-03T21:29:04Z,"Self-supervised Learning with Random-projection Quantizer for Speech
  Recognition",0.988,Yonghui Wu,http://arxiv.org/abs/2202.01855v1,http://arxiv.org/pdf/2202.01855v1
Understanding Contrastive Learning Requires Incorporating Inductive Biases,Nikunj Umesh Saunshi (Princeton University) · Jordan Ash (Microsoft Research) · Surbhi Goel (Microsoft Research) · Dipendra Kumar Misra (Microsoft Research) · Cyril Zhang (Microsoft Research) · Sanjeev Arora (Princeton University) · Sham Kakade (Harvard University) · Akshay Krishnamurthy (Microsoft Research),Nikunj Umesh Saunshi,arXiv,http://arxiv.org/abs/2202.14037v1,2022-02-28T18:59:20Z,"Understanding Contrastive Learning Requires Incorporating Inductive
  Biases",0.987,Akshay Krishnamurthy,http://arxiv.org/abs/2202.14037v1,http://arxiv.org/pdf/2202.14037v1
Sampling from wide Bayesian neural networks,Jiri Hron (University of Cambridge) · Roman Novak (Google Brain) · Jeffrey Pennington (Google Brain) · Jascha Sohl-Dickstein (Google Brain),Jiri Hron,Google,,,(PDF) ,0.082,,https://www.researchgate.net/publication/361324327_Wide_Bayesian_neural_networks_have_a_simple_weight_posterior_theory_and_accelerated_sampling,
Multiclass learning with margin: exponential rates with no bias-variance trade-off,"Stefano Vigogna (University of Rome Tor Vergata) · Giacomo Meanti (University of Genoa) · Ernesto De Vito (Dima, Università di Genova) · Lorenzo Rosasco (unige, mit, iit)",Stefano Vigogna,arXiv,http://arxiv.org/abs/2202.01773v1,2022-02-03T18:57:27Z,"Multiclass learning with margin: exponential rates with no bias-variance
  trade-off",0.988,Lorenzo Rosasco,http://arxiv.org/abs/2202.01773v1,http://arxiv.org/pdf/2202.01773v1
Adversarial Vulnerability of Randomized Ensembles,Hassan Dbouk (University of Illinois at Urbana-Champaign) · Naresh Shanbhag (University of Illinois),Hassan Dbouk,arXiv,http://arxiv.org/abs/2206.06737v1,2022-06-14T10:37:58Z,Adversarial Vulnerability of Randomized Ensembles,1.0,Naresh R. Shanbhag,http://arxiv.org/abs/2206.06737v1,http://arxiv.org/pdf/2206.06737v1
Adversarially Trained Actor Critic for Offline Reinforcement Learning,Ching-An Cheng (Microsoft Research) · Tengyang Xie (University of Illinois at Urbana-Champaign) · Nan Jiang (University of Illinois at Urbana-Champaign) · Alekh Agarwal (Microsoft Research),Ching-An Cheng,arXiv,http://arxiv.org/abs/2202.02446v1,2022-02-05T01:02:46Z,Adversarially Trained Actor Critic for Offline Reinforcement Learning,1.0,Alekh Agarwal,http://arxiv.org/abs/2202.02446v1,http://arxiv.org/pdf/2202.02446v1
Efficient Learning of CNNs using Patch Based Features,"Alon Brutzkus (Tel Aviv University) · Amir Globerson (Tel Aviv University, Google) · Eran Malach (Hebrew University Jerusalem Israel) · Alon Regev Netser (The Hebrew University of Jerusalem) · Shai Shalev-Shwartz ()",Alon Brutzkus,Google,,,GitHub - AlonNT/,0.087,,https://github.com/AlonNT/patch-based-learning,
"Independent Policy Gradient for Large-Scale Markov Potential Games: Sharper Rates, Function Approximation, and Game-Agnostic Convergence ",Dongsheng Ding (University of Southern California) · Chen-Yu Wei (University of Southern California) · Mihailo Jovanovic (University of Southern California) · Kaiqing Zhang (MIT),Dongsheng Ding,arXiv,http://arxiv.org/abs/2202.04129v2,2022-02-08T20:09:47Z,"Independent Policy Gradient for Large-Scale Markov Potential Games:
  Sharper Rates, Function Approximation, and Game-Agnostic Convergence",0.989,Mihailo R. Jovanović,http://arxiv.org/abs/2202.04129v2,http://arxiv.org/pdf/2202.04129v2
RUMs from Head-to-Head Contests,"Matteo Almanza (Sapienza University) · Flavio Chierichetti (Sapienza University) · Ravi Kumar (Google) · Alessandro Panconesi (Sapienza, University of Rome) · Andrew Tomkins (Google)",Matteo Almanza,Google,,,The World's Top ,0.213,,https://www.forbes.com/sites/joemicallef/2021/05/03/the-worlds-top-rums-according-to-san-francisco-world-spirits-competition/,
Shuffle Private Linear Contextual Bandits,Sayak Ray Chowdhury (Indian Institute of Science) · Xingyu Zhou (Wayne State University),Sayak Ray Chowdhury,arXiv,http://arxiv.org/abs/2202.05567v1,2022-02-11T11:53:22Z,Shuffle Private Linear Contextual Bandits,1.0,Xingyu Zhou,http://arxiv.org/abs/2202.05567v1,http://arxiv.org/pdf/2202.05567v1
The Geometry of Robust Value Functions,"Kaixin Wang (National University of Singapore) · Navdeep Kumar (Technion, Israel Institute of Technology) · Kuangqi Zhou (National University of Singapore) · Bryan Hooi (NUS) · Jiashi Feng (ByteDance) · Shie Mannor (Technion)",Kaixin Wang,arXiv,http://arxiv.org/abs/2201.12929v1,2022-01-30T22:12:17Z,The Geometry of Robust Value Functions,1.0,Shie Mannor,http://arxiv.org/abs/2201.12929v1,http://arxiv.org/pdf/2201.12929v1
StreamingQA: A Benchmark for Adaptation to New Knowledge over Time in Question Answering Models,Adam Liska (DeepMind) · Tomas Kocisky (DeepMind) · Elena Gribovskaya (DeepMind) · Tayfun Terzi (DeepMind) · Eren Sezener (DeepMind) · Devang Agrawal (DeepMind) · Cyprien de Masson d'Autume (DeepMind) · Tim Scholtes (DeepMind) · Manzil Zaheer (Google Research) · Susannah Young (DeepMind) · Ellen Gilsenan-McMahon (DeepMind) · Sophia Austin (DeepMind) · Phil Blunsom (DeepMind and Oxford University) · Angeliki Lazaridou (DeepMind),Adam Liska,arXiv,http://arxiv.org/abs/2205.11388v1,2022-05-23T15:33:41Z,"StreamingQA: A Benchmark for Adaptation to New Knowledge over Time in
  Question Answering Models",0.99,Angeliki Lazaridou,http://arxiv.org/abs/2205.11388v1,http://arxiv.org/pdf/2205.11388v1
Do More Negative Samples Necessarily Hurt In Contrastive Learning?,Pranjal Awasthi (Google) · Nishanth Dikkala (Google Research) · Pritish Kamath (Google Research),Pranjal Awasthi,arXiv,http://arxiv.org/abs/2205.01789v1,2022-05-03T21:29:59Z,Do More Negative Samples Necessarily Hurt in Contrastive Learning?,1.0,Pritish Kamath,http://arxiv.org/abs/2205.01789v1,http://arxiv.org/pdf/2205.01789v1
Adaptive Accelerated (Extra-)Gradient Methods with Variance Reduction,Zijian Liu (Boston University) · Ta Duy Nguyen (Boston University) · Alina Ene (Boston University) · Huy Nguyen (Northeastern University),Zijian Liu,arXiv,http://arxiv.org/abs/2201.12302v1,2022-01-28T18:07:25Z,Adaptive Accelerated (Extra-)Gradient Methods with Variance Reduction,1.0,Huy L. Nguyen,http://arxiv.org/abs/2201.12302v1,http://arxiv.org/pdf/2201.12302v1
The Transfo-k-mer: protein fitness prediction with auto-regressive transformers and inference-time retrieval,Pascal Notin (University of Oxford) · Mafalda Dias (Havard Medical School) · Jonathan Frazer (Harvard University) · Javier Marchena Hurtado (Harvard Medical School) · Aidan Gomez (Oxford) · Debora Marks (Harvard Medical School) · Yarin Gal (University of Oxford),Pascal Notin,Google,,,Icml 2022,0.068,,https://icml.cc/Conferences/2022/ScheduleMultitrack?event=19741,
Particle Transformer for Jet Tagging,Huilin Qu (CERN) · Congqiao Li (Peking University) · Sitian Qian (Peking University),Huilin Qu,arXiv,http://arxiv.org/abs/2202.03772v2,2022-02-08T10:36:29Z,Particle Transformer for Jet Tagging,1.0,Sitian Qian,http://arxiv.org/abs/2202.03772v2,http://arxiv.org/pdf/2202.03772v2
pathGCN: Learning General Graph Spatial Operators from Paths,Moshe Eliasof (Ben-Gurion University of the Negev) · Eldad Haber (University of British Columbia) · Eran Treister (Ben-Gurion University of the Negev),Moshe Eliasof,Google,,,Exploring Pathfinding ,0.22,,https://towardsdatascience.com/part-2-exploring-pathfinding-graph-algorithms-e194ffb7f569,
The State of Sparse Training in Deep Reinforcement Learning,Laura Graesser (Google) · Utku Evci (Google) · Erich Elsen (Google) · Pablo Samuel Castro (Google Brain),Laura Graesser,arXiv,http://arxiv.org/abs/2206.10369v1,2022-06-17T14:08:00Z,The State of Sparse Training in Deep Reinforcement Learning,1.0,Pablo Samuel Castro,http://arxiv.org/abs/2206.10369v1,http://arxiv.org/pdf/2206.10369v1
Showing Your Offline Reinforcement Learning Work: Online Evaluation Budget Matters,Vladislav Kurenkov (Tinkoff) · Sergey Kolesnikov (Tinkoff),Vladislav Kurenkov,arXiv,http://arxiv.org/abs/2110.04156v3,2021-10-08T14:25:21Z,"Showing Your Offline Reinforcement Learning Work: Online Evaluation
  Budget Matters",0.988,Sergey Kolesnikov,http://arxiv.org/abs/2110.04156v3,http://arxiv.org/pdf/2110.04156v3
Certifying Out-of-Domain Generalization for Blackbox Functions,Maurice Weber (ETH Zurich) · Linyi Li (UIUC) ·   (None) · Bo Li (UIUC) · Ce Zhang (ETH Zurich),Maurice Weber,arXiv,http://arxiv.org/abs/2202.01679v1,2022-02-03T16:47:50Z,Certifying Out-of-Domain Generalization for Blackbox Functions,1.0,Ce Zhang,http://arxiv.org/abs/2202.01679v1,http://arxiv.org/pdf/2202.01679v1
Towards Understanding Convergence of Simultaneous Gradient Descent-Ascent in Minimax Optimization,"Haochuan Li (MIT) · Farzan Farnia (The Chinese University of Hong Kong) · Subhro Das (MIT-IBM Watson AI Lab, IBM Research) · Ali Jadbabaie (Massachusetts Institute of Technology)",Haochuan Li,,,,,0.0,,,
Minimizing Control for Credit Assignment with Strong Feedback,Alexander Meulemans (Institute of Neuroinformatics | University of Zurich | ETH Zurich) · Maria Cervera (ETH Zurich) · Matilde Tristany Farinha (ETH Zurich) · João Sacramento (ETH Zurich) · Benjamin F. Grewe (ETH Zurich),Alexander Meulemans,arXiv,http://arxiv.org/abs/2204.07249v2,2022-04-14T22:06:21Z,Minimizing Control for Credit Assignment with Strong Feedback,1.0,Benjamin F. Grewe,http://arxiv.org/abs/2204.07249v2,http://arxiv.org/pdf/2204.07249v2
FEDNEST: Federated Bilevel Optimization,"Davoud Ataee Tarzanagh (University of Michigan) · Mingchen Li (University of California, Riverside) · Christos Thrampoulidis (University of British Columbia) · Samet Oymak (University of California, Riverside)",Davoud Ataee Tarzanagh,,,,,0.0,,,
Sanity Simulations for Saliency Methods,Joon Kim (Carnegie Mellon University) · Gregory Plumb (Carnegie Mellon University) · Ameet Talwalkar (Carnegie Mellon University),Joon Kim,arXiv,http://arxiv.org/abs/2105.06506v3,2021-05-13T18:40:57Z,Sanity Simulations for Saliency Methods,1.0,Ameet Talwalkar,http://arxiv.org/abs/2105.06506v3,http://arxiv.org/pdf/2105.06506v3
VariGrow: Variational Architecture Growing for Task-Agnostic Continual Learning based on Bayesian Novelty,Randy Ardywibowo (Texas A&M University) · Zepeng Huo (Texas A&M University) · Zhangyang “Atlas” Wang (University of Texas at Austin) · Bobak Mortazavi (Texas A&M University) · Shuai Huang (University of Washington) · Xiaoning Qian (Texas A&M University),Randy Ardywibowo,Google,,,Accepted Papers - ICML,0.142,,https://icml.cc/Conferences/2022/AcceptedPapersInitial,
Differentially Private Community Detection for Stochastic Block Models,"Mohamed Mohamed (Princeton University) · Dung Nguyen (University of Virginia) · Anil Vullikanti (Biocomplexity Institute and Dept of Computer Science, University of Virginia) · Ravi Tandon (University of Arizona)",Mohamed Mohamed,arXiv,http://arxiv.org/abs/2202.00636v1,2022-01-31T18:59:19Z,Differentially Private Community Detection for Stochastic Block Models,1.0,Ravi Tandon,http://arxiv.org/abs/2202.00636v1,http://arxiv.org/pdf/2202.00636v1
Adversarial robustness against multiple and single lplpl_p-threat models via quick fine-tuning of robust classifiers,Francesco Croce (University of Tuebingen) · Matthias Hein (University of Tübingen),Francesco Croce,arXiv,http://arxiv.org/abs/2105.12508v1,2021-05-26T12:20:47Z,"Adversarial robustness against multiple $l_p$-threat models at the price
  of one and how to quickly fine-tune robust models to another threat model",0.659,Matthias Hein,http://arxiv.org/abs/2105.12508v1,http://arxiv.org/pdf/2105.12508v1
Finite-Sum Coupled Compositional Stochastic Optimization: Theories and Applications,Bokun Wang (The University of Iowa) · Tianbao Yang (The University of Iowa),Bokun Wang,arXiv,http://arxiv.org/abs/2202.12396v5,2022-02-24T22:39:35Z,"Finite-Sum Coupled Compositional Stochastic Optimization: Theory and
  Applications",0.964,Tianbao Yang,http://arxiv.org/abs/2202.12396v5,http://arxiv.org/pdf/2202.12396v5
Constrained Discrete Black-Box Optimization using Mixed-Integer Programming,Theodore Papalexopoulos (Massachusetts Institute of Technology) · Christian Tjandraatmadja (Google) · Ross Anderson (Google Research) · Juan Pablo Vielma (Google and MIT) · David Belanger (Google),Theodore Papalexopoulos,arXiv,http://arxiv.org/abs/2110.09569v3,2021-10-18T18:39:53Z,"Constrained Discrete Black-Box Optimization using Mixed-Integer
  Programming",0.987,David Belanger,http://arxiv.org/abs/2110.09569v3,http://arxiv.org/pdf/2110.09569v3
Data-Efficient Double-Win Lottery Tickets from Robust Pre-training,Tianlong Chen (University of Texas at Austin) · Zhenyu Zhang (University of Science and Technology of China) · Sijia Liu (Michigan State University) · Yang Zhang (MIT-IBM Watson AI Lab) · Shiyu Chang (UCSB) · Zhangyang “Atlas” Wang (University of Texas at Austin),Tianlong Chen,arXiv,http://arxiv.org/abs/2206.04762v1,2022-06-09T20:52:50Z,Data-Efficient Double-Win Lottery Tickets from Robust Pre-training,1.0,Zhangyang Wang,http://arxiv.org/abs/2206.04762v1,http://arxiv.org/pdf/2206.04762v1
SpaceMAP: Visualizing High-Dimensional Data by Space Expansion,Xinrui Zu (Delft University of Technology) · Qian Tao (Delft University of Technology),Xinrui Zu,Google,,,S MAP: ,0.174,,https://openreview.net/pdf?id=wmQCFqV9r8L,
Linearity Grafting: How Neuron Pruning Helps Certifiable Robustness,Tianlong Chen (University of Texas at Austin) · Huan Zhang (CMU) · Zhenyu Zhang (University of Science and Technology of China) · Shiyu Chang (UCSB) · Sijia Liu (Michigan State University) · Pin-Yu Chen (IBM Research AI) · Zhangyang “Atlas” Wang (University of Texas at Austin),Tianlong Chen,arXiv,http://arxiv.org/abs/2206.07839v1,2022-06-15T22:42:29Z,Linearity Grafting: Relaxed Neuron Pruning Helps Certifiable Robustness,0.928,Zhangyang Wang,http://arxiv.org/abs/2206.07839v1,http://arxiv.org/pdf/2206.07839v1
Online Learning for Min Sum Set Cover and Pandora’s Box,Evangelia Gergatsouli (UW-Madison) · Christos Tzamos (UW-Madison),Evangelia Gergatsouli,arXiv,http://arxiv.org/abs/2202.04870v2,2022-02-10T07:12:44Z,Online Learning for Min Sum Set Cover and Pandora's Box,0.982,Christos Tzamos,http://arxiv.org/abs/2202.04870v2,http://arxiv.org/pdf/2202.04870v2
Provably Efficient Offline Reinforcement Learning for Partially Observable Markov Decision Processes,Hongyi Guo (Northwestern University) · Qi Cai (Northwestern University) · Yufeng Zhang (Northwestern University) · Zhuoran Yang (Yale University) · Zhaoran Wang (Northwestern University),Hongyi Guo,,,,,0.0,,,
Discovering Generalizable Spatial Goal Representations via Graph-based Active Reward Learning,Aviv Netanyahu (MIT) · Tianmin Shu (MIT) · Josh Tenenbaum (MIT) · Pulkit Agrawal (MIT),Aviv Netanyahu,,,,,0.0,,,
The CLRS Algorithmic Reasoning Benchmark,Petar Veličković (DeepMind / University of Cambridge) · Adrià Puigdomenech Badia (Deepmind) · David Budden (DeepMind) · Razvan Pascanu (DeepMind) · Andrea Banino (DeepMind) · Misha Dashevskiy (DeepMind) · Raia Hadsell (DeepMind) · Charles Blundell (DeepMind),Petar Veličković,,,,,0.0,,,
"Bayesian Model Selection, the Marginal Likelihood, and Generalization",Sanae Lotfi (New York University) · Pavel Izmailov (New York University) · Gregory Benton (New York University) · Micah Goldblum (New York University) · Andrew Wilson (New York University),Sanae Lotfi,arXiv,http://arxiv.org/abs/2202.11678v2,2022-02-23T18:38:16Z,"Bayesian Model Selection, the Marginal Likelihood, and Generalization",1.0,Andrew Gordon Wilson,http://arxiv.org/abs/2202.11678v2,http://arxiv.org/pdf/2202.11678v2
SpeqNets: Sparsity-aware permutation-equivariant graph networks,"Christopher Morris (RWTH Aachen) · Sandra Kiefer (RWTH Aachen University) · Gaurav Rattan (RWTH Aachen, Germany) · Siamak Ravanbakhsh (McGill - Mila)",Christopher Morris,arXiv,http://arxiv.org/abs/2203.13913v2,2022-03-25T21:17:09Z,SpeqNets: Sparsity-aware Permutation-equivariant Graph Networks,1.0,Siamak Ravanbakhsh,http://arxiv.org/abs/2203.13913v2,http://arxiv.org/pdf/2203.13913v2
Efficient First-Order Bayesian Optimization via Structured Automatic Differentiation,Sebastian Ament (Cornell University) · Carla Gomes (Cornell University),Sebastian Ament,Google,,,(PDF) Scalable ,0.02,,https://www.researchgate.net/publication/361362236_Scalable_First-Order_Bayesian_Optimization_via_Structured_Automatic_Differentiation,
"A Tighter Analysis of Spectral Clustering, and Beyond",Peter Macgregor (University of Edinburgh) · He Sun (University of Edinburgh),Peter Macgregor,Google,,,tight relaxations ,0.31,,https://dl.acm.org/doi/10.5555/2986459.2986723,
Volatility Based Kernels and Moving Average Means for Accurate Forecasting with Gaussian Processes,Gregory Benton (New York University) · Wesley Maddox (New York University) · Andrew Wilson (New York University),Gregory Benton,,,,,0.0,,,
Nested Exponential Weights and the Red Bus / Blue Bus Paradox,"Matthieu Martin (Criteo AI Lab) · Panayotis Mertikopoulos (CNRS and Criteo AI Lab) · Thibaud J Rahier (INRIA) · Houssam Zenati (Criteo, INRIA)",Matthieu Martin,Google,,,Chapter 4 ,0.085,,https://tfresource.github.io/modechoice/the-multinomial-logit-model.html,
Mitigating Gender Bias in Face Recognition using the von Mises-Fisher Mixture Model,Jean-Rémy Conti (Télécom Paris      Idemia) · Nathan NOIRY (Telecom Paris) · Vincent Despiegel (Idemia) · Stéphane Gentric (IDEMIA) · Stephan Clemencon (Telecom ParisTech),Jean-Rémy Conti,,,,,0.0,,,
Anticorrelated Noise Injection for Improved Generalization,Antonio Orvieto (ETH Zurich) · Hans Kersting (ENS / INRIA) · Frank Proske (University of Oslo) · Francis Bach (INRIA - Ecole Normale Supérieure) · Aurelien Lucchi (ETH Zurich),Antonio Orvieto,arXiv,http://arxiv.org/abs/2202.02831v1,2022-02-06T18:52:21Z,Anticorrelated Noise Injection for Improved Generalization,1.0,Aurelien Lucchi,http://arxiv.org/abs/2202.02831v1,http://arxiv.org/pdf/2202.02831v1
How Tempering Fixes Data Augmentation in Bayesian Neural Networks,Lorenzo Noci (ETH Zürich) · Gregor Bachmann (ETH Zurich) · Thomas Hofmann (ETH Zurich),Lorenzo Noci,arXiv,http://arxiv.org/abs/2205.13900v1,2022-05-27T11:06:56Z,How Tempering Fixes Data Augmentation in Bayesian Neural Networks,1.0,Thomas Hofmann,http://arxiv.org/abs/2205.13900v1,http://arxiv.org/pdf/2205.13900v1
Massively Parallel kkk-Means Clustering for Perturbation Resilient Instances,Vincent Cohen-Addad (Google) · Vahab Mirrokni (Google Research) · Peilin Zhong (Google Research),Vincent Cohen-Addad,Google,,,Large Scale K-Median ,0.268,,http://proceedings.mlr.press/v130/voevodski21a/voevodski21a.pdf,
Resilient and Communication Efficient Learning for Heterogeneous Federated Systems,Zhuangdi Zhu (Michigan State University) · Junyuan Hong (Michigan State University) · Steve Drew (University of Calgary) · Jiayu Zhou (Michigan State University),Zhuangdi Zhu,Google,,,FedHe: ,0.09,,https://deepai.org/publication/fedhe-heterogeneous-models-and-communication-efficient-federated-learning,
Scalable Computation of Causal Bounds,Madhumitha Shridharan (Columbia University) · Garud Iyengar (Columbia),Madhumitha Shridharan,Google,,,Estimating ,0.25,,https://www.sciencedirect.com/science/article/pii/S0888613X17303882,
Improved Regret for Differentially Private Exploration in Linear MDP,Dung Ngo (University of Minnesota) · Giuseppe Vietri (University of Minnesota) · Steven Wu (Carnegie Mellon University),Dung Ngo,arXiv,http://arxiv.org/abs/2202.01292v1,2022-02-02T21:32:09Z,Improved Regret for Differentially Private Exploration in Linear MDP,1.0,Zhiwei Steven Wu,http://arxiv.org/abs/2202.01292v1,http://arxiv.org/pdf/2202.01292v1
Risk-Averse No-Regret Learning in Online Convex Games,Zifan Wang (Royal Institute of Technology) · Yi Shen (Duke University) · Michael Zavlanos (Duke University),Zifan Wang,arXiv,http://arxiv.org/abs/2203.08957v2,2022-03-16T21:36:47Z,Risk-Averse No-Regret Learning in Online Convex Games,1.0,Michael M. Zavlanos,http://arxiv.org/abs/2203.08957v2,http://arxiv.org/pdf/2203.08957v2
Describing Differences between Text Distributions with Natural Language,Ruiqi Zhong (UC Berkeley) · Charlie Snell (UC Berkeley) · Dan Klein (UC Berkeley) · Jacob Steinhardt (UC Berkeley),Ruiqi Zhong,arXiv,http://arxiv.org/abs/2201.12323v2,2022-01-28T18:38:13Z,Describing Differences between Text Distributions with Natural Language,1.0,Jacob Steinhardt,http://arxiv.org/abs/2201.12323v2,http://arxiv.org/pdf/2201.12323v2
Feature selection using e-values,Subhabrata Majumdar (Splunk) · Snigdhansu Chatterjee (University of Minnesota),Subhabrata Majumdar,arXiv,http://arxiv.org/abs/2206.05391v2,2022-06-11T01:34:29Z,Feature Selection using e-values,1.0,Snigdhansu Chatterjee,http://arxiv.org/abs/2206.05391v2,http://arxiv.org/pdf/2206.05391v2
RECAPP: Crafting a More Efficient Catalyst for Convex Optimization,Yair Carmon (Tel Aviv University) · Arun Jambulapati (Stanford) · Yujia Jin (Stanford University) · Aaron Sidford (Stanford),Yair Carmon,arXiv,http://arxiv.org/abs/2206.08627v1,2022-06-17T08:40:32Z,RECAPP: Crafting a More Efficient Catalyst for Convex Optimization,1.0,Aaron Sidford,http://arxiv.org/abs/2206.08627v1,http://arxiv.org/pdf/2206.08627v1
Direct Behavior Specification via Constrained Reinforcement Learning,Julien Roy (Mila) · Roger Girgis (Mila - Quebec AI Institute) · Joshua Romoff (Ubisoft) · Pierre-Luc Bacon (Mila) · Christopher Pal (MILA),Julien Roy,arXiv,http://arxiv.org/abs/2112.12228v6,2021-12-22T21:12:28Z,Direct Behavior Specification via Constrained Reinforcement Learning,1.0,Christopher Pal,http://arxiv.org/abs/2112.12228v6,http://arxiv.org/pdf/2112.12228v6
Architecture Agnostic Federated Learning for Neural Networks,Disha Makhija (University of Texas at Austin) · Xing Han (The University of Texas at Austin) · Nhat Ho (University of Texas at Austin) · Joydeep Ghosh (The University of Texas at Austin),Disha Makhija,arXiv,http://arxiv.org/abs/2202.07757v2,2022-02-15T22:16:06Z,Architecture Agnostic Federated Learning for Neural Networks,1.0,Joydeep Ghosh,http://arxiv.org/abs/2202.07757v2,http://arxiv.org/pdf/2202.07757v2
What Language Model Architecture and Pretraining Objective Works Best for Zero-Shot Generalization?,Colin Raffel (Google Brain) · Adam Roberts (Google Brain) · Hyung Won Chung (Google) · Iz Beltagy (Allen Institute for AI (AI2)) · Daniel Hesslow (Lighton) · Julien Launay (École Normale Supérieure) · Thomas Wang (Hugging Face) · Teven Le Scao (Hugging Face),Colin Raffel,arXiv,http://arxiv.org/abs/2204.05832v1,2022-04-12T14:19:49Z,"What Language Model Architecture and Pretraining Objective Work Best for
  Zero-Shot Generalization?",0.985,Colin Raffel,http://arxiv.org/abs/2204.05832v1,http://arxiv.org/pdf/2204.05832v1
DepthShrinker: A New Compression Paradigm Towards Boosting Real-Hardware Efficiency of Compact Neural Networks,Yonggan Fu (Rice University) · Haichuan Yang (Facebook) · Jiayi Yuan (Rice University) · Meng Li (Facebook Inc) · Cheng Wan (Rice University) · Raghuraman Krishnamoorthi (Facebook) · Vikas Chandra (Facebook) · Yingyan Lin (Rice University),Yonggan Fu,arXiv,http://arxiv.org/abs/2206.00843v2,2022-06-02T02:32:47Z,"DepthShrinker: A New Compression Paradigm Towards Boosting Real-Hardware
  Efficiency of Compact Neural Networks",0.991,Yingyan Lin,http://arxiv.org/abs/2206.00843v2,http://arxiv.org/pdf/2206.00843v2
No-Regret Learning in Partially-Informed Auctions,"Wenshuo Guo (University of California, Berkeley) · Michael Jordan (UC Berkeley) · Ellen Vitercik (University of California, Berkeley)",Wenshuo Guo,arXiv,http://arxiv.org/abs/2202.10606v1,2022-02-22T01:15:51Z,No-Regret Learning in Partially-Informed Auctions,1.0,Ellen Vitercik,http://arxiv.org/abs/2202.10606v1,http://arxiv.org/pdf/2202.10606v1
Model soups: averaging weights of multiple fine-tuned models improves accuracy without increasing inference time,"Mitchell Wortsman (University of Washington) · Gabriel Ilharco (University of Washington) · Samir Gadre (Columbia University) · Rebecca Roelofs (Google Research) · Raphael Gontijo Lopes (Google Brain) · Ari Morcos (Facebook AI Research (FAIR)) · Hongseok Namkoong (Columbia University) · Ali Farhadi (University of Washington, Allen Institue for AI) · Yair Carmon (Tel Aviv University) · Simon Kornblith (Google Brain) · Ludwig Schmidt (Toyota Research Institute)",Mitchell Wortsman,arXiv,http://arxiv.org/abs/2203.05482v2,2022-03-10T17:03:49Z,"Model soups: averaging weights of multiple fine-tuned models improves
  accuracy without increasing inference time",0.991,Ludwig Schmidt,http://arxiv.org/abs/2203.05482v2,http://arxiv.org/pdf/2203.05482v2
Generalization and Robustness Implications in Object-Centric Learning,"Andrea Dittadi (Technical University of Denmark) · Samuele Papa (University of Amsterdam) · Michele De Vita (DTU) · Bernhard Schölkopf (MPI for Intelligent Systems Tübingen, Germany) · Ole Winther (DTU and KU) · Francesco Locatello (Amazon Lablet)",Andrea Dittadi,arXiv,http://arxiv.org/abs/2107.00637v3,2021-07-01T17:51:11Z,Generalization and Robustness Implications in Object-Centric Learning,1.0,Francesco Locatello,http://arxiv.org/abs/2107.00637v3,http://arxiv.org/pdf/2107.00637v3
