title,Authors,1stAuthor,result-from,result-id,result-pub_date,result-title,result-ttl_similarity,result-author,result-link,result-pdf_link
Deletion Robust Submodular Maximization over Matroids,PAUL DUETTING (Google) · Federico Fusco (Sapienza University of Rome) · Silvio Lattanzi (Google) · Ashkan Norouzi-Fard (Google) · Morteza Zadimoghaddam (Google),PAUL DUETTING,Google,,,Efficient algorithms for ,0.128,,https://deepai.org/publication/efficient-algorithms-for-robust-submodular-maximization-under-matroid-constraints,
Probabilistically Robust Learning: Balancing Average- and Worst-case Performance,"Alex Robey (University of Pennsylvania) · Luiz F. O. Chamon (University of California, Berkeley) · George J. Pappas (University of Pennsylvania) · Hamed Hassani (University of Pennsylvania)",Alex Robey,arXiv,http://arxiv.org/abs/2202.01136v3,2022-02-02T17:01:38Z,"Probabilistically Robust Learning: Balancing Average- and Worst-case
  Performance",0.988,Hamed Hassani,http://arxiv.org/abs/2202.01136v3,http://arxiv.org/pdf/2202.01136v3
Probabilistic Inverse Optimal Transport,Wei-Ting Chiu (Rutgers University - Newark) · Pei Wang (Rutgers University-Newark) · Patrick Shafto (IAS / Rutgers University),Wei-Ting Chiu,arXiv,http://arxiv.org/abs/2112.09754v2,2021-12-17T20:33:27Z,Discrete Probabilistic Inverse Optimal Transport,0.897,Patrick Shafto,http://arxiv.org/abs/2112.09754v2,http://arxiv.org/pdf/2112.09754v2
Learning Symmetric Embeddings for Equivariant World Models,Jung Yeon Park (Northeastern University) · Ondrej Biza (Northeastern University) · Linfeng Zhao (Northeastern University) · Jan-Willem van de Meent (University of Amsterdam) · Robin Walters (Northeastern University),Jung Yeon Park,arXiv,http://arxiv.org/abs/2204.11371v1,2022-04-24T22:31:52Z,Learning Symmetric Embeddings for Equivariant World Models,1.0,Robin Walters,http://arxiv.org/abs/2204.11371v1,http://arxiv.org/pdf/2204.11371v1
Generalized Federated Learning via Sharpness Aware Minimization,Zhe Qu (University of South Florida) · Xingyu Li (Mississippi State University) · Rui Duan (University of South Florida) · Zhuo Lu (University of South Florida) · Yao Liu (University of South Florida) · Bo Tang (Mississippi State University),Zhe Qu,arXiv,http://arxiv.org/abs/2206.02618v1,2022-06-06T13:54:41Z,Generalized Federated Learning via Sharpness Aware Minimization,1.0,Zhuo Lu,http://arxiv.org/abs/2206.02618v1,http://arxiv.org/pdf/2206.02618v1
Stability Based Generalization Bounds for Exponential Family Langevin Dynamics,"Arindam Banerjee (UIUC) · Tiancong Chen (University of Minnesota) · Xinyan Li (University of Minnesota, Twin Cities) · Yingxue Zhou (University of Minnesota)",Arindam Banerjee,arXiv,http://arxiv.org/abs/2201.03064v1,2022-01-09T18:15:22Z,"Stability Based Generalization Bounds for Exponential Family Langevin
  Dynamics",0.987,Yingxue Zhou,http://arxiv.org/abs/2201.03064v1,http://arxiv.org/pdf/2201.03064v1
Congested Bandits: Optimal Routing via Short-term Resets,Pranjal Awasthi (Google) · Kush Bhatia (UC Berkeley) · Sreenivas Gollapudi (Google Research) · Kostas Kollias (Google Research),Pranjal Awasthi,,,,,0.0,,,
Provable Stochastic Optimization for Global Contrastive Learning: Small Batch Does Not Harm Performance,Zhuoning Yuan (The University of Iowa) · Yuexin Wu (Google) · Zi-Hao Qiu (Nanjing University) · Xianzhi Du (Google Inc.) · Lijun Zhang (Nanjing University) · Denny Zhou (Google Brain) · Tianbao Yang (The University of Iowa),Zhuoning Yuan,arXiv,http://arxiv.org/abs/2202.12387v1,2022-02-24T22:16:53Z,"Provable Stochastic Optimization for Global Contrastive Learning: Small
  Batch Does Not Harm Performance",0.99,Tianbao Yang,http://arxiv.org/abs/2202.12387v1,http://arxiv.org/pdf/2202.12387v1
Certified Neural Network Watermarks with Randomized Smoothing,"Arpit Bansal (University of Maryland, College Park) · Ping-yeh Chiang (University of Maryland, College Park) · Michael Curry (University of Maryland College Park) · Rajiv Jain (Adobe Research) · Curtis Wigington (Adobe Research) · Varun Manjunatha (Adobe Research) · John P Dickerson (Arthur AI & Univ. of Maryland) · Tom Goldstein (University of Maryland)",Arpit Bansal,Google,,,Generalizing ,0.297,,https://blog.ml.cmu.edu/2020/09/25/generalizing-randomized-smoothing/,
What Can Linear Interpolation of Neural Network Loss Landscapes Tell Us?,Tiffany Vlaar (University of Edinburgh) · Jonathan Frankle (MIT CSAIL),Tiffany Vlaar,arXiv,http://arxiv.org/abs/2106.16004v2,2021-06-30T11:54:04Z,What can linear interpolation of neural network loss landscapes tell us?,1.0,Jonathan Frankle,http://arxiv.org/abs/2106.16004v2,http://arxiv.org/pdf/2106.16004v2
Multirate Training of Neural Networks,Tiffany Vlaar (University of Edinburgh) · Benedict Leimkuhler (University of Edinburgh),Tiffany Vlaar,arXiv,http://arxiv.org/abs/2106.10771v2,2021-06-20T22:44:55Z,Multirate Training of Neural Networks,1.0,Benedict Leimkuhler,http://arxiv.org/abs/2106.10771v2,http://arxiv.org/pdf/2106.10771v2
Private frequency estimation via projective geometry,Vitaly Feldman (Apple) · Jelani Nelson (UC Berkeley) · Huy Nguyen (Northeastern University) · Kunal Talwar (Apple),Vitaly Feldman,arXiv,http://arxiv.org/abs/2203.00194v1,2022-03-01T02:49:55Z,Private Frequency Estimation via Projective Geometry,1.0,Kunal Talwar,http://arxiv.org/abs/2203.00194v1,http://arxiv.org/pdf/2203.00194v1
Improving Task-free Continual Learning by Distributionally Robust Memory Evolution,"Zhenyi Wang (University at Buffalo) · Li Shen (JD Explore Academy) · Le Fang (University at Buffalo-SUNY) · Qiuling Suo (State University of New York at Buffalo) · Tiehang Duan (State University of New York at Buffalo) · Mingchen Gao (University at Buffalo, SUNY)",Zhenyi Wang,Google,,,"Mingchen Gao, University at Buffalo SUNY",0.18,,https://cse.buffalo.edu/~mgao8/,
SMODICE: Versatile Offline Imitation Learning via State Occupancy Matching,Jason Yecheng Ma (University of Pennsylvania) · Andrew Shen (University of Melbourne) · Dinesh Jayaraman (University of Pennsylvania) · Osbert Bastani (University of Pennsylvania),Jason Yecheng Ma,,,,,0.0,,,
Convergence of Uncertainty Sampling for Active Learning,Anant Raj (INRIA- ENS and UIUC) · Francis Bach (INRIA - Ecole Normale Supérieure),Anant Raj,arXiv,http://arxiv.org/abs/2110.15784v1,2021-10-29T13:51:30Z,Convergence of Uncertainty Sampling for Active Learning,1.0,Francis Bach,http://arxiv.org/abs/2110.15784v1,http://arxiv.org/pdf/2110.15784v1
Revisiting End-to-End Speech-to-Text Translation From Scratch,Biao Zhang (University of Edinburgh) · Barry Haddow () · Rico Sennrich (University of Zurich),Biao Zhang,arXiv,http://arxiv.org/abs/2206.04571v1,2022-06-09T15:39:19Z,Revisiting End-to-End Speech-to-Text Translation From Scratch,1.0,Rico Sennrich,http://arxiv.org/abs/2206.04571v1,http://arxiv.org/pdf/2206.04571v1
Data Augmentation as Feature Manipulation: a story of desert cows and grass cows,Ruoqi Shen (University of Washington) · Sebastien Bubeck (Microsoft Research) · Suriya Gunasekar (Microsoft Research),Ruoqi Shen,arXiv,http://arxiv.org/abs/2203.01572v1,2022-03-03T08:47:43Z,"Data Augmentation as Feature Manipulation: a story of desert cows and
  grass cows",0.988,Suriya Gunasekar,http://arxiv.org/abs/2203.01572v1,http://arxiv.org/pdf/2203.01572v1
Deploying Convolutional Networks on Untrusted Platforms Using 2D Holographic Reduced Representations,"Mohammad Mahmudul Alam (University of Maryland, Baltimore County) · Edward Raff (Booz Allen Hamilton) · Tim Oates (University Of Maryland Baltimore County) · James Holt (Laboratory for Physical Sciences)",Mohammad Mahmudul Alam,arXiv,http://arxiv.org/abs/2206.05893v1,2022-06-13T03:31:39Z,"Deploying Convolutional Networks on Untrusted Platforms Using 2D
  Holographic Reduced Representations",0.99,James Holt,http://arxiv.org/abs/2206.05893v1,http://arxiv.org/pdf/2206.05893v1
Examining Scaling and Transfer of Language Model Architectures for Machine Translation,Biao Zhang (University of Edinburgh) · Behrooz Ghorbani (Google Research) · Ankur Bapna (Google Research) · Yong Cheng (Google) · Xavier Garcia (Google) · Jonathan Shen (Independent) · Orhan Firat (Google),Biao Zhang,arXiv,http://arxiv.org/abs/2202.00528v3,2022-02-01T16:20:15Z,"Examining Scaling and Transfer of Language Model Architectures for
  Machine Translation",0.989,Orhan Firat,http://arxiv.org/abs/2202.00528v3,http://arxiv.org/pdf/2202.00528v3
Scalable MCMC Sampling for Nonsymmetric Determinantal Point Processes,Insu Han (Yale University) · Mike Gartrell (Criteo AI Lab) · Elvis Dohmatob (Meta) · Amin Karbasi (Yale),Insu Han,arXiv,http://arxiv.org/abs/2201.08417v2,2022-01-20T19:21:59Z,Scalable Sampling for Nonsymmetric Determinantal Point Processes,0.962,Amin Karbasi,http://arxiv.org/abs/2201.08417v2,http://arxiv.org/pdf/2201.08417v2
Unified Scaling Laws for Routed Language Models,Aidan Clark (OpenAI) · Diego de Las Casas (DeepMind) · Aurelia Guy (Google Inc.) · Arthur Mensch (Deepmind) · Michela Paganini (DeepMind) · Jordan Hoffmann (DeepMind) · Bogdan Damoc (DeepMind) · Blake Hechtman (Google) · Trevor Cai (DeepMind) · Sebastian Borgeaud (DeepMind) · George van den Driessche (DeepMind) · Eliza Rutherford (DeepMind) · Tom Hennigan (DeepMind) · Matthew Johnson (Google Brain) · Albin Cassirer (DeepMind) · Chris Jones (DeepMind) · Elena Buchatskaya (DeepMind) · David Budden (DeepMind) · Laurent Sifre (DeepMind) · Simon Osindero (DeepMind) · Oriol Vinyals (Google DeepMind) · Marc'Aurelio Ranzato (Deepmind) · Jack Rae (DeepMind) · Erich Elsen (Google) · Koray Kavukcuoglu (DeepMind) · Karen Simonyan (Inflection AI),Aidan Clark,arXiv,http://arxiv.org/abs/2202.01169v2,2022-02-02T17:58:52Z,Unified Scaling Laws for Routed Language Models,1.0,Karen Simonyan,http://arxiv.org/abs/2202.01169v2,http://arxiv.org/pdf/2202.01169v2
Adversarially Robust Models may not Transfer Better: Sufficient Conditions for Domain Transferability from the View of Regularization,Xiaojun Xu (University of Illinois at Urbana-Champaign) · Yibo Zhang (University of Illinois at Urbana-Champaign) · Evelyn Ma (UIUC) · Hyun Ho Son (University of Illinois Urbana-Champaign) · Sanmi Koyejo (UIUC) · Bo Li (UIUC),Xiaojun Xu,arXiv,http://arxiv.org/abs/2202.01832v1,2022-02-03T20:26:27Z,"Adversarially Robust Models may not Transfer Better: Sufficient
  Conditions for Domain Transferability from the View of Regularization",0.993,Bo Li,http://arxiv.org/abs/2202.01832v1,http://arxiv.org/pdf/2202.01832v1
Certified Robustness Against Natural Language Attacks by Causal Intervention,Haiteng Zhao (Peking University) · Chang Ma (Peking University) · Xinshuai Dong (Xiamen University) · Anh Tuan Luu (Nanyang Technological University) · Zhi-Hong Deng (Peking University) · Hanwang Zhang (Nanyang Technological University),Haiteng Zhao,arXiv,http://arxiv.org/abs/2205.12331v2,2022-05-24T19:20:48Z,"Certified Robustness Against Natural Language Attacks by Causal
  Intervention",0.987,Hanwang Zhang,http://arxiv.org/abs/2205.12331v2,http://arxiv.org/pdf/2205.12331v2
First-Order Regret in Reinforcement Learning with Linear Function Approximation: A Robust Estimation Approach,Andrew Wagenmaker (University of Washington) · Yifang Chen (University of Washington) · Max Simchowitz (MIT) · Simon Du (University of Washington) · Kevin Jamieson (University of Washington),Andrew Wagenmaker,arXiv,http://arxiv.org/abs/2112.03432v3,2021-12-07T00:29:57Z,"First-Order Regret in Reinforcement Learning with Linear Function
  Approximation: A Robust Estimation Approach",0.991,Kevin Jamieson,http://arxiv.org/abs/2112.03432v3,http://arxiv.org/pdf/2112.03432v3
Contextual Bandits with Large Action Spaces: Made Practical,Yinglun Zhu (University of Wisconsin-Madison) · Dylan Foster (Microsoft Research) · John Langford (Microsoft Research) · Paul Mineiro (Microsoft),Yinglun Zhu,Google,,,',0.0,,https://www.microsoft.com/en-us/research/blog/contextual-bandit-breakthrough-enables-deeper-personalization/,
PINs: Progressive Implicit Networks for Multi-Scale Neural Representations,Zoe Landgraf (Meta (FAIAR)) · Alexander Sorkine Hornung (Meta) · ricardo cabral (meta),Zoe Landgraf,arXiv,http://arxiv.org/abs/2202.04713v2,2022-02-09T20:33:37Z,"PINs: Progressive Implicit Networks for Multi-Scale Neural
  Representations",0.987,Ricardo Silveira Cabral,http://arxiv.org/abs/2202.04713v2,http://arxiv.org/pdf/2202.04713v2
Bayesian Nonparametrics for Offline Skill Discovery,Valentin Villecroze (Layer 6) · Harry Braviner (Layer 6 AI) · Panteha Naderian (Layer 6 AI) · Chris Maddison (University of Toronto) · Gabriel Loaiza-Ganem (Layer 6 AI),Valentin Villecroze,arXiv,http://arxiv.org/abs/2202.04675v2,2022-02-09T19:01:01Z,Bayesian Nonparametrics for Offline Skill Discovery,1.0,Gabriel Loaiza-Ganem,http://arxiv.org/abs/2202.04675v2,http://arxiv.org/pdf/2202.04675v2
Understanding Doubly Stochastic Clustering,"Tianjiao Ding (Johns Hopkins University) · Derek Lim (MIT) · Rene Vidal (Johns Hopkins University, USA) · Benjamin Haeffele (Johns Hopkins University)",Tianjiao Ding,Google,,,(PDF) ,0.042,,https://www.researchgate.net/publication/221618713_Doubly_Stochastic_Normalization_for_Spectral_Clustering,
ButterflyFlow: Building Invertible Layers with Butterfly Matrices,"Chenlin Meng (Stanford University) · Linqi Zhou (University of California, Los Angeles) · Kristy Choi (Stanford University) · Tri Dao (Stanford) · Stefano Ermon (Stanford University)",Chenlin Meng,Google,,,Butterflies Are All You Need: A Universal ,0.299,,https://dawn.cs.stanford.edu/2019/06/13/butterfly/,
Self-supervised models of audio effectively explain human cortical responses to speech,Aditya Vaidya (University of Texas at Austin) · Shailee Jain (The University of Texas at Austin) · Alexander Huth (The University of Texas at Austin),Aditya Vaidya,arXiv,http://arxiv.org/abs/2205.14252v1,2022-05-27T22:04:02Z,"Self-supervised models of audio effectively explain human cortical
  responses to speech",0.989,Alexander G. Huth,http://arxiv.org/abs/2205.14252v1,http://arxiv.org/pdf/2205.14252v1
Entropic Causal Inference: Graph Identifiability,Spencer Compton (MIT) · Kristjan Greenewald (IBM) · Dmitriy Katz (IBM Research) · Murat Kocaoglu (Purdue University),Spencer Compton,arXiv,http://arxiv.org/abs/2101.03501v1,2021-01-10T08:37:54Z,Entropic Causal Inference: Identifiability and Finite Sample Results,0.724,Dmitriy Katz,http://arxiv.org/abs/2101.03501v1,http://arxiv.org/pdf/2101.03501v1
GLaM: Efficient Scaling of Language Models with Mixture-of-Experts,Nan Du (Google) · Yanping Huang (Google Brain) · Andrew Dai (Google) · Simon Tong (Google Brain) · Dmitry Lepikhin (Google) · Yuanzhong Xu (Google) · Maxim Krikun (Google) · Yanqi Zhou (Google) · Adams Wei Yu (Google Brain) · Orhan Firat (Google) · Barret Zoph (Google) · William Fedus (Google Brain) · Maarten Bosma (Google) · Zongwei Zhou (Google Inc.) · Tao Wang (Google Inc.) · Emma Wang (Google) · Kellie Webster (Google) · Marie Pellat (Google) · Kevin Robinson (Google) · Kathleen Meier-Hellstern (Google) · Toju Duke (Google) · Lucas Dixon (Google) · Kun Zhang (Google) · Quoc Le (Google Brain) · Yonghui Wu (Google) · Zhifeng Chen (Google) · Claire Cui (Google),Nan Du,arXiv,http://arxiv.org/abs/2112.06905v1,2021-12-13T18:58:19Z,GLaM: Efficient Scaling of Language Models with Mixture-of-Experts,1.0,Claire Cui,http://arxiv.org/abs/2112.06905v1,http://arxiv.org/pdf/2112.06905v1
MAML and ANIL Provably Learn Representations,Liam Collins (University of Texas at Austin) · Aryan Mokhtari (UT Austin) · Sewoong Oh (University of Washington) · Sanjay Shakkottai (University of Texas at Austin),Liam Collins,arXiv,http://arxiv.org/abs/2202.03483v1,2022-02-07T19:43:02Z,MAML and ANIL Provably Learn Representations,1.0,Sanjay Shakkottai,http://arxiv.org/abs/2202.03483v1,http://arxiv.org/pdf/2202.03483v1
Three-stage Evolution and Fast Equilibrium for SGD with Non-degerate Critical Points,Yi Wang (Johns Hopkins University) · Zhiren Wang (Pennsylvania State University),Yi Wang,Google,,,PDF ,0.045,,http://www.personal.psu.edu/zxw14/research/ThreeStageEquilibrium.pdf,
Kernel Methods for Radial Transformed Compositional Data with Many Zeros,Junyoung Park (KAIST) · Changwon Yoon (Korea Advanced Institute of Science and Technology) · Cheolwoo Park (KAIST) · Jeongyoun Ahn (Korea Advanced Institute of Science and Technology),Junyoung Park,Google,,,Non-parametric regression models ,0.21,,https://arxiv.org/pdf/2002.05137,
Nearly Optimal Catoni’s M-estimator for Infinite Variance,Sujay Bhatt (Baidu Research) · Guanhua Fang (Baidu USA) · Ping Li (Baidu Research) · Gennady Samorodnitsky (Cornell University),Sujay Bhatt,Google,,,A generalized Catoni's ,0.35,,https://projecteuclid.org/journalArticle/Download?urlid=10.1214%2F21-EJS1911,
How to Leverage Unlabeled Data in Offline Reinforcement Learning?,Tianhe (Kevin) Yu (Stanford University) · Aviral Kumar (UC Berkeley) · Yevgen Chebotar (Google) · Karol Hausman (Google Brain) · Chelsea Finn (Stanford) · Sergey Levine (UC Berkeley),Tianhe,arXiv,http://arxiv.org/abs/2202.01741v2,2022-02-03T18:04:54Z,How to Leverage Unlabeled Data in Offline Reinforcement Learning,0.992,Sergey Levine,http://arxiv.org/abs/2202.01741v2,http://arxiv.org/pdf/2202.01741v2
Simplex Neural Population Learning: Any-Mixture Bayes-Optimality in Symmetric Zero-sum Games,Siqi Liu (DeepMind) · Marc Lanctot (DeepMind) · Luke Marris (DeepMind) · Nicolas Heess (DeepMind),Siqi Liu,arXiv,http://arxiv.org/abs/2205.15879v2,2022-05-31T15:27:38Z,"Simplex Neural Population Learning: Any-Mixture Bayes-Optimality in
  Symmetric Zero-sum Games",0.989,Nicolas Heess,http://arxiv.org/abs/2205.15879v2,http://arxiv.org/pdf/2205.15879v2
Variational On-the-Fly Personalization,Jangho Kim (Seoul National University) · Jun-Tae Lee (Qualcomm AI Research) · Simyung Chang (Qualcomm Korea YH) · NOJUN KWAK (Seoul National University),Jangho Kim,arXiv,http://arxiv.org/abs/1910.00775v1,2019-10-02T04:37:23Z,Variational Temporal Abstraction,0.6,Yoshua Bengio,http://arxiv.org/abs/1910.00775v1,http://arxiv.org/pdf/1910.00775v1
Towards Optimal Exploration in Linear Markov Decision Processes: Covering and Dimension-Optimal PAC,Andrew Wagenmaker (University of Washington) · Yifang Chen (University of Washington) · Max Simchowitz (MIT) · Simon Du (University of Washington) · Kevin Jamieson (University of Washington),Andrew Wagenmaker,Google,,,21925 PDFs | Review articles ,0.125,,https://www.researchgate.net/topic/Markov-Decision-Process/publications,
Refined Convergence Rates for Maximum Likelihood Estimation under Finite Mixture Models,Tudor Manole (Carnegie Mellon University) · Nhat Ho (University of Texas at Austin),Tudor Manole,arXiv,http://arxiv.org/abs/2202.08786v2,2022-02-17T17:46:40Z,"Refined Convergence Rates for Maximum Likelihood Estimation under Finite
  Mixture Models",0.989,Nhat Ho,http://arxiv.org/abs/2202.08786v2,http://arxiv.org/pdf/2202.08786v2
Molecular Graph Representation Learning via Heterogeneous Motif Graph Construction,Zhaoning Yu (Iowa state university) · Hongyang Gao (Iowa State University),Zhaoning Yu,arXiv,http://arxiv.org/abs/2202.00529v2,2022-02-01T16:21:01Z,"Molecular Representation Learning via Heterogeneous Motif Graph Neural
  Networks",0.81,Hongyang Gao,http://arxiv.org/abs/2202.00529v2,http://arxiv.org/pdf/2202.00529v2
Regret Bounds for Stochastic Shortest Path Problems with Linear Function Approximation,Daniel Vial (UT Austin / UIUC) · Advait Parulekar (University of Texas at Austin) · Sanjay Shakkottai (University of Texas at Austin) · R Srikant (UIUC),Daniel Vial,arXiv,http://arxiv.org/abs/2105.01593v3,2021-05-04T16:05:08Z,"Regret Bounds for Stochastic Shortest Path Problems with Linear Function
  Approximation",0.989,R. Srikant,http://arxiv.org/abs/2105.01593v3,http://arxiv.org/pdf/2105.01593v3
Characterizing and overcoming the greedy nature of learning in multi-modal deep neural networks,"Nan Wu (NYU Center for Data Science) · Stanislaw Jastrzebski (Molecule.one / Jagiellonian University) · Kyunghyun Cho (New York University, Genentech) · Krzysztof J Geras (New York University)",Nan Wu,arXiv,http://arxiv.org/abs/2202.05306v2,2022-02-10T20:11:21Z,"Characterizing and overcoming the greedy nature of learning in
  multi-modal deep neural networks",0.99,Krzysztof J. Geras,http://arxiv.org/abs/2202.05306v2,http://arxiv.org/pdf/2202.05306v2
Phasic Self-Imitative Reduction for Sparse-Reward Goal-Conditioned Reinforcement Learning,"Yunfei Li (Tsinghua University) · Tian Gao (Tsinghua University) · Jiaqi Yang (University of California, Berkeley) · Huazhe Xu (Stanford University) · Yi Wu (UC Berkeley)",Yunfei Li,Google,,,Advances in studying ,0.145,,https://www.ncbi.nlm.nih.gov/pmc/articles/PMC3725633/,
Dual Perspective of Label-Specific Feature Learning for Multi-Label Classification,Jun-Yi Hang (Southeast University) · Min-Ling Zhang (Southeast University),Jun-Yi Hang,,,,,0.0,,,
Distributional Hamilton-Jacobi-Bellman Equations for Continuous-Time Reinforcement Learning,"Harley Wiltzer (McGill University, Mila) · David Meger (McGill University) · Marc Bellemare (Google Brain)",Harley Wiltzer,arXiv,http://arxiv.org/abs/2205.12184v2,2022-05-24T16:33:54Z,"Distributional Hamilton-Jacobi-Bellman Equations for Continuous-Time
  Reinforcement Learning",0.989,Marc G. Bellemare,http://arxiv.org/abs/2205.12184v2,http://arxiv.org/pdf/2205.12184v2
Deep Network Approximation in Terms of Intrinsic Parameters,Shijun Zhang (National University of Singapore) · Zuowei Shen (National University of Singapore) · Haizhao Yang (University of Maryland College Park),Shijun Zhang,arXiv,http://arxiv.org/abs/2111.07964v2,2021-11-15T18:20:38Z,Deep Network Approximation in Terms of Intrinsic Parameters,1.0,Shijun Zhang,http://arxiv.org/abs/2111.07964v2,http://arxiv.org/pdf/2111.07964v2
The Primacy Bias in Deep Reinforcement Learning,"Evgenii Nikishin (Mila, Université de Montréal) · Max Schwarzer (Mila, Université de Montréal) · Pierluca D'Oro (Mila, Université de Montréal) · Pierre-Luc Bacon (Mila) · Aaron Courville (Université de Montréal)",Evgenii Nikishin,arXiv,http://arxiv.org/abs/2205.07802v1,2022-05-16T16:48:36Z,The Primacy Bias in Deep Reinforcement Learning,1.0,Aaron Courville,http://arxiv.org/abs/2205.07802v1,http://arxiv.org/pdf/2205.07802v1
Stabilizing Q-learning with Linear Architectures for Provable Efficient Learning ,Andrea Zanette (Stanford University) · Martin Wainwright (UC Berkeley / Voleon),Andrea Zanette,arXiv,http://arxiv.org/abs/2206.00796v1,2022-06-01T23:26:51Z,"Stabilizing Q-learning with Linear Architectures for Provably Efficient
  Learning",0.969,Martin J. Wainwright,http://arxiv.org/abs/2206.00796v1,http://arxiv.org/pdf/2206.00796v1
Streaming Algorithm for Monotone k-Submodular Maximization with Cardinality Constraints,Alina Ene (Boston University) · Huy Nguyen (Northeastern University),Alina Ene,arXiv,http://arxiv.org/abs/1911.12959v3,2019-11-29T05:59:58Z,"Optimal Streaming Algorithms for Submodular Maximization with
  Cardinality Constraints",0.874,Andrew Suh,http://arxiv.org/abs/1911.12959v3,http://arxiv.org/pdf/1911.12959v3
Retroformer: Pushing the Limits of End-to-end Retrosynthesis Transformer,Yue Wan (Tencent) · Chang-Yu (Kim) Hsieh (Tencent) · Shengyu Zhang (Tencent) · Ben Liao (Tencent),Yue Wan,,,,,0.0,,,
Last Iterate Risk Bounds of SGD with Decaying Stepsize for Overparameterized Linear Regression,"Jingfeng Wu (Johns Hopkins University) · Difan Zou (UCLA) · Vladimir Braverman (Johns Hopkins University) · Quanquan Gu (University of California, Los Angeles) · Sham Kakade (Harvard University)",Jingfeng Wu,arXiv,http://arxiv.org/abs/2110.06198v1,2021-10-12T17:49:54Z,"Last Iterate Risk Bounds of SGD with Decaying Stepsize for
  Overparameterized Linear Regression",0.989,Sham M. Kakade,http://arxiv.org/abs/2110.06198v1,http://arxiv.org/pdf/2110.06198v1
Optimizing Sequential Experimental Design with Deep Reinforcement Learning,Tom Blau (CSIRO's Data61) · Edwin V Bonilla (CSIRO's Data61) · Iadine Chades (CSIRO) · Amir Dezfouli (CSIRO's Data61),Tom Blau,arXiv,http://arxiv.org/abs/2202.00821v3,2022-02-02T00:23:05Z,"Optimizing Sequential Experimental Design with Deep Reinforcement
  Learning",0.987,Amir Dezfouli,http://arxiv.org/abs/2202.00821v3,http://arxiv.org/pdf/2202.00821v3
On the Robustness of CountSketch to Adaptive Inputs,"Edith Cohen (Google Research and Tel Aviv University) · Xin Lyu (University of California, Berkeley) · Jelani Nelson (UC Berkeley) · Tamas Sarlos (Google) · Moshe Shechner (Tel Aviv University) · Uri Stemmer (Tel Aviv University and Google Research)",Edith Cohen,arXiv,http://arxiv.org/abs/2202.13736v1,2022-02-28T13:04:41Z,On the Robustness of CountSketch to Adaptive Inputs,1.0,Uri Stemmer,http://arxiv.org/abs/2202.13736v1,http://arxiv.org/pdf/2202.13736v1
Exploiting Independent Instruments: Identification and Distribution Generalization,Sorawit Saengkyongam (University of Copenhagen) · Leonard Henckel (Copenhagen University) · Niklas Pfister (University of Copenhagen) · Jonas Peters (University of Copenhagen),Sorawit Saengkyongam,arXiv,http://arxiv.org/abs/2202.01864v1,2022-02-03T21:49:04Z,"Exploiting Independent Instruments: Identification and Distribution
  Generalization",0.988,Jonas Peters,http://arxiv.org/abs/2202.01864v1,http://arxiv.org/pdf/2202.01864v1
